,commnets,Rating
19,MetropolisMetropolis is one of the most exciting and exceptional works of art that humankind has produced This epic science fiction film is one of Germanys famous silent movies created by Fritz Lang and liberated in  the period between the two World WarsThis movie represents the expressionist cinema and shows us the repression of human needs by the machine age Langs creation of a selfdestructive society is a protest against the machine age Metropolis is one of the most magnificent cities of  is kept alive by the unceasing work of the underground people who live in slavery and is enjoyed by wealthy and educated people The Austrian director of the movie Fritz Lang presents the story of a master John Federsen who sees people as machines working constantly to maintain the luxury and technology of his metropolis On the other side his son Freder falls in love with one of the underground workers who is a spiritual leader for the slaves The son recognizes the unsentimental heart of his father and starts a revolution The city gets flooded and Maria Freders love regains the workers trust after a robot had stolen her identity she finds her loved one after saving the citys children and the workers shake hands with the masterExpressionism tries to simplify the world and to understand it emotionally in a subjective way It is very important to understand this definition of this dynamic violent and distorted movement in order to understand that Lang tried to externalize his own internal vision of the world through simple expressions The name metropolis comes from the Greeks and means mothercity It has this significance because a metropolis is the biggest form of a technologically and economically developed city Nevertheless referring to the movie name this film can be considered as the mother city of all cinematic clichés In this story there are two main characters Maria and Freder These two characters are also the heroes of the story because they are the ones who rescue the population from being drowned in the flood John Federson is a person full of empowering feelings who only thinks of himself and of his city forgetting about the ones who work for him All the fantasies that he has come true through the power of his workers but he never thinks about the danger they are in while working for him This man wants so much power that he is almost hypnotized by it; he is obsessed and possessed by the power of inventions and creationsOn the other hand Maria is just a symbol of munificence her soul is pure and she is seen like an angel who brings peace to the world Maria convoys the people in a church settling area She is shown as sanctity a holy person that is surrounded by the light of the candles She is positioned higher than the workers who carefully listen to her as she speaks about peace unity and their salvation by a mediator that will soon come Her eyes inspire confidence and kindness as she kisses Freder in the church scene In general all she does is for the good of humanity One thing that she repeats in the movie is Between the head and hands there must be a heart  This means that she realizes the bad things that the head John Frederson does and the good things that the hands workers do But she knows that these workers should not be treated poorly or like robots and that she can be the heart which can persuade the head and the hands to cooperate to come to common interests Maria as her name suggests is also a biblical motif She explains to the workers the story of the Tower of Babel The workers in the story destroy this tower which parallels how the movie will end with the destruction of the machines by the workforce Maria is still the representation of Jesus mother because she is trying to save the lives of the underground children She would sacrifice herself and alike Mother Mary she has a strong faith in the creator of the world All the scenes of this film are perfectly created at the eye level so that anyone is able to view the action However there is also a birds eye view at the beginning of the movie as the panorama of the city is shown from high above the ground This view was created to give us an impression of how widely extended and huge Metropolis is In addition the focus of the dramatic camera angles with bold shadows is on the disproportioned landscape as well as on the rightangled buildings There are moments in which the camera focuses on fast movement scenes like the dancing of the robot in the nightclub and scenes where it focuses on slow movement like in the beginning of the film where the slaves are shown going into the working area at a certain pace and aligned as robots When more people are involved in a scene like the one in which all the children are surrounding Maria as she rings the danger bell the angles are vertical triangular but when only one person is focused there is a closeup to allow us to read that characters expressions and feelings A good example would be the closeups on the master Fredersons eyes as he asks his secretary why his son was allowed to go underground and as well after that scene when he is thinking in order to suggest this dictators meditation and frustration Another important aspect of the camera and of Expressionism that I have remarked was the scene in which the mad scientist tries to run away from Freder and kidnaps Maria He is walking up on the roof of a sharpangled building holding Maria under his arm as if nothing would happen The same scene was notable in Robert Wienes film The Cabinet of Dr Caligari as Cesare walks up on the roof with the kidnapped fiancé and the city crowd follows himTime also is significant in the film because the clock keeps showing up in the most important scenes Time is evident in Fredersons office as his son challenges him to have mercy for the people as well as he is talking to his secretary Still only a small portion of the clock is shown in these shots and it means the time in which the master can think what decisions to take On the other hand a gigantic clock is shown as Freder finds an exhausted worker trying to turn a wallclock Freder understands the struggle of this man and replaces him There is where he finds out that at  pm Maria will have a meetingBut all that we have seen in this movie is not only made to show us the great importance of this silent SF film that can keep the watcher alive by its impressive music and can inspire contemporary movies like Matrix  but for its great historical importance Fritz Lang expressed a social life in this movie as well as a political one After WWI when Germany had lost a war peoples lives were a disaster Everyone was disoriented and could not keep up with the tragedy that was going on and maybe there were some influences of the great antiSemitism that was supposed to follow But Germany was a great disaster as well and there was nothing it could have done to prevent it because many troubles kept adding up over the years and this country had to be defeated morally and politically as well as economically Even if Germanys wish of reconstruction was as utopic as Fredersens wish of a technological city the postwar inflation had a big contribution on cinemas development,0
20,I typically dont like silent films but I decided to watch this one for two reasons  First I usually like scifi movies and second Metropolis had received so many glowing reviews that I couldnt pass it up  However my opinion of this film is below what most reviewers have been sayingKinos digitally remastered version on DVD is very impressive  The sound and picture quality are both excellent  However I have to conclude that favorable reviews of this film are likely based on nostalgia on the films influence on future films and on the incredible visual effects given its year of release  Film history buffs and silent film fans should see this movie  I thought this was a good film but not a great one  A rating of  is much too high and at # there are plenty of better films ranked below itFirst the good parts of the film  The special effects are excellent for a pres film  The mindlessness of the working class is portrayed well in how they work the decisions they make and in how easily they are led/misled  The main character is well developed throughout the film and the audience can relate to him well  The film is visually stunning and impressive  The story of the working class vision of the future machinemen etc have had a very strong influence on many films which came later,4
21,For its time this movie has stunning visuals kind of Kubrickesqe in appearance especially the opening scenes of workers going and coming from work Its very strange with the group leaving walking with their heads down like zombiesThe set designs in here are also something that might draw your attention This really has a futuristic look I thought the visuals were fascinating This was German expressionist filmwork at its height I would think Director Fritz Lang went on to become a very famous man in his profession This wasnt his first effort but I think this might have been the film that put him on the map so to speak Several years later he gained a lot more fame with M At any rate with the photography sets and overall Flash Gordontype scifi look this must have been a real eyeopener to movies viewers  years ago I still think they look very cool today The music was also very dramatic at least in this restored  surround sound restoration DVD put out by KlinoObviously the eye makeup on men and the exaggerated motions by actors in silent films look a little hokey but I was mesmerized by Brigitte Helm who plays Maria and her evil clone She is something else! I also appreciated Klinos explanation of lost footage and how they did the best they could do to still make the story flow together They did an outstanding job I wouldnt attempt to watch this on anything less than this DVD which looks pretty darn goodThis is a worker story about a man wanting to trade his comfortable life to join the oppressed workers who do their thing beneath the earth in Metropolis Workers are seen as nothing but replaceable robots If someone gets hurt they get carted away and replaced immediately but some other zombielike human Of course people being mistreated can only take it for so long before rebellion Thats history from the days of the Jewish slaves in Egypt to today so thats part of this story too I wont say more to ruin itI dont want to mislead people on one major point todays audiences watching this Few people in  watch silent movies To ask them to sit through two hours of a silent film is obviously asking a lot I had to break this up into several viewings myself but thats okay I still enjoyed itbut it a silent movie this long is not easy to sit through You have to be a student of film or a big film buff to watch thisbut those people will be rewarded Over  reviews in here show you this film has enough to offer or at least take a look Now that this restored version is available check it out!,7
22,OK first of all Im not some kind of actionjunkie who thinks that the Rambotrilogy is the best movies of all time I am a person who think that other silents like Nosferatu and The Battleship Potemkin are entertainingAlthough I loved the previous movies referred to I thought this was one of the most dull movies ever As entertainment this movie cant go very far On a scale rating its abilities to entertain it gets a / from meAs a milestone in the history of movies it goes all the way to the top The special effects were great to have been made almost  years ago The editing was great It must have been one of the most expensive movie made to that date On the scale of how important a chapter in the cinematic history this is I will rate it a / That means a total / This also means that you should rather check out really good silents like Chaplins Modern Times Eisensteins The Battleship Potemkin and Murnaus Nosferatu,8
23,Fritz Lang was constantly experimenting with ways to tell stories by way of the visual medium and his  opus Metropolis is the cream of the crop of examples of this Perhaps it was seeing the film in the greatest possible format a fully restored print on the KINO DVD filled with intertitles to keep the story complete that had me appreciate it more but even if I had seen the film on a scratchy print or with not very appropriate music ie Giorgio Moroders experimental cut it would still be affecting At the core of the story Lang and his collaborator Thea von Harbou the sides of good vs evil or at least the complete lack of understanding of the powerful over the weak is set up so strongly that even when it has its fairytale type of heaviness to it it doesnt seem to feel compromised in strength or relevance for adults This is the kind of film that should work for anyone young and old as it deals with universal themes ie The mediator between Head and Hands must be the Heart!The story leaves room for the visual style to come through Freder is the son of a kind of Imperial man over the workers who die for the machines of Metropolis Joh Frederson He feels the sorrow and pain of the people and goes down to their level to be one of them He falls in love with the most compassionate and angelic of women Maria played by the beautiful Brigitte Helm in multiple roles she plays without a fault who succumbs to capture after the jealously of Freders father Enter the robot a marvel of a mad scientist who gets transposed from Maria and becomes the havocwrecker of the part of Metropolis I wont reveal too much of the story except to mention that as a foreshadowing for Freder for the last act as he wakes up in one scene the Book of Revelations sits in his lapAmidst in all of this Metropolis is a masterpiece of visual effects cameratricks and of course editing if I wouldnt quite rank Metropolis in my alltime top ten favorites I would rank it in terms of the editing and pacing Lang uses which is apparent even in a permanently truncated version It starts off with the image of the machine transposed over steam and then soon moves to a vision of a city that was not far off from how it is in present day cars moving on roads built to the sky airplanes flying everywhich way and mammoth skyscrapers built in extravagant ways But its not just the use of the models or the sets or the backdrops or even the use of space and atmosphere in most of Langs shots which are all spectacular its also the use of light that really caught my attention throughout the film One thing I remember still days after seeing the film is the use of one spotlight on the character of Maria in a suspense scene it also appears in other scenes I think Its little things like that which make as big an impact as the montages the superimpositions of faces and eyes in the dreamlike shotsAnd of course Langs greatest innovation with the film is that in telling a futuristic story he goes beyond his time period in stylizing As I mentioned with the pacing being unique it was surprising though maybe not as much from seeing his classic M that many of the suspense sequences mob scenes/riots chases I knew that this is the same kind of styling thats used today for many of the most modern of sciencefiction/action films In its own way much like Stanley Kubricks  Space Oddysey it breaks the mold of conventional forms of storytelling while not completely abandoning the storytelling form Although Metropolis has a checkered history of being cut down by countries and it hasnt been seen in its full form in almost eighty years what remains doesnt seem at all dated or crude Quite the opposite its visual expressiveness its use of time and character and action and its deliberate pacing makes it ahead of its time and influential and at the same time keeping itself unique Its a tale were all familiar with being the tale of love and compassion coming into play in an industrial cruel world which Im sure was even more relevant to post WW Germany at the time filmed with a mix of overthetop melodrama megabudget setpieces and designs that confound the senses Add the appropriate music and youve got a classic fantasy A tremendous film to see two three a dozen times over though some of those too impatient for films without spoken words or by the operatic dramatic side of it all may become disappointed or frustrated,10
24,For many years the initially flopped and consequently butchered Metropolis Fritz Lang made in the mid twenties of the past century could be appreciated at least for its qualities as the indispensable sciencefiction trailblazer in motion picture history What was severely lacking from the plot however finally emerged on screen again after the famous Buenos Aires reel find which brought a quarter of what was missing from the film back from the dead With the new painstaking  restoration effort also came a grandiose symphony orchestra studio recording of the original Gottfried Huppertz score  and the results make movie buffs prone to be blown away and this time for realThe technical brilliance and visual lavishness of Fritz Langs oeuvre was always undisputed already at its time and only matched by fellow German Murnaus ingenious approaches on filmmaking Theres so much and dense imagery that generations of future filmmakers would draw from this newly emerging archetype Among the unforgettable scenes are the giant heart machine which turns into a moloch in one of the heros visions the Babel tower teeming with utopian life the enormous sets elevators and masses and masses of enslaved and rebellious people the staggering creation of the first robot all set against the dominant dichotomy between  literally  those living above and those dying below There are echoes of communism here of nazi ideology of the dangers and abysses of industrialization technology and there are also glimpses of humanity Not perfect in all its components the film nevertheless has everything pioneering in it  and more Fritz Lang while having some reservations himself referred to the picture as a signpost for new destinations and thats exactly what it became now that we can look at the great scifi pictures of the past century In them and through them Metropolis still lives and once we revisit the original again we might yet be surprised that it miraculously still points ahead,10
