,commnets,Rating
0,Technically speaking I have seen this Fritz Lang silent scifi before but this was the first time I saw it in any shape by which I could fairly evaluate it I had previously watched Metropolis on a public domain VHS from the s The print was terribly scratched and while there were a few memorable images the story was so incoherent that their context was usually unclear Though this was clearly not the best way to see Metropolis I was still left with an impression of this supposed classic as a dusty museum piece that was praised by critics because they were expected to like it So finally seeing a restored and expanded copy was as much as a revelation as seeing Once Upon a Time in the West letter boxed in how it led me to reevaluate my opinion of the movie The movie is a strange mixture of political speculation political parable apocalyptic fantasy and religious allegory It depicts a futuristic city that is divided between the wretched workers who toil in the depths tending the machines and the upper classes who dwell in luxury up in the skyscrapers The hero the idle pampered son of the citys supervisor Joh Fredersen changes his ways and becomes concerned with the plight of the lower classes after catching a glimpse of Maria the Madonna of the workers His father meanwhile is plotting to thwart Maria with the help of the mad scientist Rotwang who has discovered how to create robot replicas of human beings One of the most surprising things about watching this version is just how much I didnt see In addition to restoring scenes to the film the DVD also includes inter titles to explain pieces of the plot that cannot be found in any version With these changes the story becomes much clearer particularly the machinations of Rotwang and the master of Metropolis Perhaps most importantly a whole new subplot is added involving the heros dead mother Hel who was loved by both his father and Rotwang With this clarification of the backstory the close but adversarial relationship between Rotwang and Fredersen becomes much clearer In some ways it recalls the family backstory of the Star Wars movies Of course the real strength of Metropolis isnt the story which is pretty silly and probably wouldnt have worked in anything but a silent film but its amazing visuals which in their scale and ambitiousness look forward to  and Blade Runner Actually though in most respects silent films now look primitive one area in which they have the edge over modern filmmaking is in their frequently grandiose production design Metropolis employs huge sets to show the hellish factories of the subterranean world The models of the citys towering skyscrapers are also surprisingly convincing for a s film Even beyond the expansive production design and for the time special effects Langs visuals are all consistently inventive The robot Maria provides some of the movies most iconic images including her transformation into a human being In a later scene she performs for upperclass men in a nightclub and as she performs a striptease that in s Germany was apparently seen as very decadent the screen is filled with wet staring eyeballs A sign of Langs visual lavishness and the studios that he doesnt hesitate to throw in lavish dream and hallucination sequences to drive home a point or illustrate a characters state of mind For instance when the hero first enters the subterranean city and sees rows upon rows of workers toiling on huge machines he imagines the furnace transforming into a monstrous idols head into which the workers are being sacrificed At another point while hes sick in bed he imagines statues of the Seven Deadly Sins coming to life and advancing out from a wall in a cathedral When Maria preaches her message of peace and understanding to the workers she tells them the story of the Tower of Babel of a management vs labor parable and Lang gives us spectacular images of the towers construction and fall In a sound film many of these scenes would have seemed redundant and overliteral but theyre what silent cinema does best tell a story without the advantage or obstacle of dialogue The story is a little slow to start but once it picks up Metropolis becomes one of the most directly involving silent films that Ive seen In addition to being a pioneering example of the cinematic possibilities of science fiction Metropolis also has to be one of the earliest disaster films as the workers riot and sabotage the machines endangering the entire city Lang creates a sense of rising fury and nihilism in the last hour that in a strange way reminded me of what was going to happen to Germany in less than  years,9
1,Who ever heard of an epic science fiction film? Especially in the s? Sure some science fiction movies are huge today such as George Lucas latest goofy Star Wars movie but in  Fritz Lang came out with a brilliant film about what the future would be like if people went on living the way they were living back then And sure enough we went right ahead living the way we were living the population got bigger and more crowded and now modern society is not a whole lot different from what was presented in Metropolis The story is about a young rich kid without a care in the world who becomes concerned about the way that society Metropolis was run by his father John Frederson the master of Metropolis He lives in a Pleasure Garden high above the level of the workers and he worries about what would happen if the huge number of workers were to turn against his father given the terrible conditions under which they live and work Some of the best scenes in the film take place in the underground mines showing the workers portrayed as little more than components on a gigantic sinister looking machine The scene where the machine overheated even contained some impressive stunts as well as interesting cinematography as the machine transforms into a giant devillooking monster  After countless workers are consumed by it no wonder this was Hitlers favorite film they are immediately replaced by other workers who go right to the same spots that the previous men left and resume their robotic movements If some of these scenes men can be seen being carried away on stretchers after having been injured and the rest of the workers keep right on working hardly even noticingThe way that the workers are portrayed as lifeless machines is one of the more potent elements of this film as well as the most revealing about the directors intentions When his son complains about the tragic things that go on in the mines Frederson replies that such accidents are unavoidable but his son still insists that they deserve credit for building the city This is the kind of content that foreshadows some serious mutiny and at the same time it shows what may very well happen when large groups of people feel mistreated `Never underestimate the power of stupid people in large groups is a saying that doesnt necessarily only apply to stupid people as Metropolis suggests Fritz Lang brilliantly portrays this very complex story with extremely limited dialogue and the result is still compelling today The special effects in this film are decades ahead of its time  it even resembles The Fifth Element in many ways except that the two films can hardly be compared  and the acting and especially the elaborately created sets are stunning to say the least An excellent film Metropolis is one of the few that should never be forgotten,10
2,I doubt that Id ever seen anything resembling a complete version of METROPOLIS before though certain of its scenes were familiar to me if only as used and abused in such films as Diane Keatons HEAVEN   In any case whatever I had seen before had nothing like the clarity and beauty of the Kino restoration  I expected to be distracted by the restorations technique of concise written descriptions of missing sequences but the narrative coherence that these provided was definitely worth it  As exaggerated as the style of acting seems by contemporary standards some performances such as the Master of the city are amazingly nuanced and layered and Brigitte Helm is stunning as both Maria and her evil clone The meticulous design of the film the unerring camera placement and Langs muscular choreography of the crowd scenes are breathtaking Id thought of METROPOLIS as a curiosity important = dull but now Ive come to appreciate it as the seminal work it has always been,10
3,Fritz Langs Metropolis is the first true masterpiece of science fiction in film You can see its influence in films such as Star Wars The Matrix Dr Strangelove or How I Learned to Stop Worrying and Love the Bomb Blade Runner and countless others Despite the fact that parts of the film are no longer available the efforts to reconstruct the original film from its remains are valiant enough to provide enough to make the story clear The special effects were far ahead of their time and the set designs were in some cases phenomenal I can see where some people may not enjoy this movie It is hard for some to really appreciate a movie that is  years old because a lot has happened in film since then Yet if you look at the basic elements of this movie  its story characters artwork cinematography etc I believe this movie has just as much to offer now as it must have in the late s Also take into consideration the asthetics of German expressionist film when viewing this The performances and set designs are going to be over the top That was part of the style Metropolis may not be for everyone but for those willing to read between the lines this film still has a lot to offer!,8
4,In the future the society of Metropolis is divided in two social classes the workers who live in the underground below the machines level and the dominant classes that lives on the surface The workers are controlled by their leader Maria Brigitte Helm who wants to find a mediator between the upper class lords and the workers since she believes that a heart would be necessary between brains and muscles Maria meets Freder Fredersen Gustav Fröhlich the son of the Lord of Metropolis Johhan Fredersen Alfred Abel in a meeting of the workers and they fall in love for each other Meanwhile Johhan decides that the workers are no longer necessary for Metropolis and uses a robot pretending to be Maria to promote a revolution of the working class and eliminate themMetropolis is a fantastic futuristic view of the fight of classes When Metropolis was shot it was a romantic revolutionary period of mankind history with socialist movements around the world Fritz Lang directed and wrote the screenplay of this masterpiece certainly inspired in this historical moment and defending a position of agreement and understanding between both sides showing that they need each other I wonder how this great director was able to produce such special effects in  with very primitive cameras and equipment The city of Metropolis is visibly inspired in New York The performance of Brigitte Helm is stunning in her double role and this movie is mandatory for any person that says that like cinema as an art My vote is tenTitle Brazil MetropolisNote On  March  I saw this film again on BluRay,10
5,Metropolis is surely one of the greatest films ever made  Its scope its reach its magnitude and its message are truly incredible even by todays standards of filmmaking  Seen in context of its premier in  Metropolis is a giant of filmdom and film history  Lots of people always ask what makes a movie great and in particular Metropolis  A great film is one that stirs the imagination leaves the viewer with images that will last perhaps forever forces contemplation of issues dealing with the very essence of life and achieves a kind of immortality  Metropolis is a film that succeeds with each of these criteria  Metropolis is a film that hailed in a new era of making films with it futuristic settings halluciatory scenes and its breadth of spirit and sheer scope most clearly exhibited by its cast of epic proportions  There are images that blind the viewer with genius such as the beginning scene of the changing of the workers or the creation of the robot Maria  Metropolis challenges its viewers to think about their relationship with society both as a whole and with each individual as well as contemplate the rationale of divisions amongst peoples and groups  Lastly Metropolis has stood the test of time  It is a landmark film and an ignitor for the evolution of the science fiction/fantasy film genre  The story itself is simplea Biblical allegory about how people with a vision should share that vision in order to make it happen  The film is anything but simple  It is immense and a rich legacy that director Fritz Lang has left us,0
6,I was shocked to find myself riveted to this movie This is without a doubt the best scifi movie Ive ever seen! Let me explain my position We have all seen modern scifi movies and argued over which is the best ever made but those film makers have high speed film and computers Imagine trying to make a movie today with only the tools available to Fritz Lang in  and even if you used a modern camcorder it would be nigh impossible! This is a must see for all persons interested in the history of film as well as just good fun for everyone The social metaphores as well as the religious and philosophical double meanings are a sight to behold,10
7,This must be one of the greatest movies of all time I found myself almost in a state of shock during the whole movie Everything was perfect The story was great the filming was pure genius and the effects directly from another dimensionI dont think any movie after this one have gotten so much out of the available effects of the time as this one Nowadays they have super computers generating special effects Sure they look good but its no big deal making them Back in  computers werent even invented yet all effects had to be done by hand or in simple editing And when you take a look at all the thins that have been done in this movie its impossible not to get impressed Huge buildings explosions flooding picture phones however did he come up with the very idea? transformation sequences robots and so on No movie has ever pulled the limits of special effects as much as this one Star Wars and Jurassic Park are also known as limit pullers in special effects but they dont even come closeThen you have the filming Everything is perfect The use of body language is tremendous the light setting perfect everything well timed and perfectly captured by the camera Ive never been witness to such a treat in filming other placesAnd the story!!! Perfect in every detail Intriguing exciting and thrilling with lots of religious undertones and tyranic leaders No wonder Hitler liked this movieI dont know how the original music of the film was but the new music for the restored  minute version I saw was really good and moodsetingAll in all This is one of the most perfect movies of all time and it deserves anything it can get Never has a / been as secure as for this movie,10
8,Silent movies are not for everyone Neither are subtitles Those brave enough to view a movie with no sound and words that are far and few between should definitely enjoy this silent masterpiece One of the biggest productions of its time Metropolis still holds its own when set design and special effects are compared But what Metropolis really has is orginality This GermanExpressionist film had such originality in everything from its costumes to its views of a future modern city that its ideas can still be seen everywhere in modern scifi Star Warss CPO was based on Bridgette Helms robot Dark City and Brazil both have Metropolis lookalike cities This is a very good movie Its too bad most movies dont have its originality,9
9,Fritz Langs groundbreaking landmark remains one of the biggest mysteries in the world of cinema How can a movie thatll soon turn  years old still look so disturbingly futuristic?? The screenplay by Thea Von Harbou is still very haunting and courageously assails social issues that are of all ages The world has been divided into two main categories thinkers &amp; workers! If you belong to the first category you can lead a life of luxury above ground but if youre a worker your life isnt worth a penny and youre doomed to perilous labor underground The further expansions and intrigues in the screenplay are too astonishing to spoil so I strongly advise that you check out the film yourself Its essential viewing anyway! Metropolis is a very demanding filmexperience and definitely not always entertaining But as it is often the case with silentcinema classics the respect and admiration youll develop during watching it will widely excel the enjoymentaspect Fritz brutal visual style still looks innovative and few directors since were able to recreate a similarly nightmarish composition of horizontal and vertical lines Many supposedly restored versions have been released over the years in  and  for example but the version is still the finest in my opinion even though that one already isnt as detailed and punctual as Lang intended it Metropolis perhaps is THE most important and influential movie ever made  A Space Odyssey Star Wars and Blade Runner owe their existence or at least their power to it,8
10,Metropolis is my alltime favourite movie so Ive saved this for the last review that I plan to write for this wonderful website IMDb Ive enjoyed sharing my experiences of the movies Ive seen but now Im moving on to other passionsAlthough written by Fritz Langs wife Thea von Harbou Metropolis was originally Langs idea he was inspired by the sight of New Yorks skyscrapers when he sailed to America in  During his American trip he visited the set of The Phantom of the Opera and met Lon Chaney! Too bad the encounter wasnt filmedDespite its epic power Metropolis makes very little sense The two major male characters are a father and son named Freder and Fredersen so why is the one named Freder*sen* the father not son of the one cried Freder? Why does the master of Metropolis deliberately connive to destroy the city that he built? Why is Rotwangs crude little cottage the only preFredersen building that wasnt demolished during the construction of this city? Von Harbous very long and unwieldy novelisation of her script establishes this fact but never explains it How and why did Rotwangs hightech laboratory manage to get constructed BENEATH that cottage without disturbing it?For modern viewers some of the plots incoherence can be blamed on missing footage particularly in American prints The distributors for this films original Stateside release commissioned playwright Channing Pollock to translate the German titles A major subplot of the backstory features a deceased woman named Hel who was married to Rotwang but left him to marry Fredersen and give birth to Freder This unseen womans name could not easily be changed for the American version due to a couple of shots of her memorial engraved with the Teutonic name HEL Apparently Pollock feared that American viewers would be offended by this words similarity to Hell so he simply excised the entire subplot from this long movieThe reallife drama on the set of Metropolis mustve been quite interesting in itself Mad scientist Rotwang alias Doctor Strangeglove is played by actor Rudolf KleinRogge who had been married to scenarist von Harbou before she left him to marry Fritz Lang the mastermind of this film In Metropolis Rotwangs wife left him to marry the master of Metropolis Id love to know how KleinRogge felt about the fact that his reallife marital and sexual situation was the inspiration for key plot elements of this movie  and I wonder how KleinRogge felt about knowing that the entire cast and crew knew this as wellMost astonishing about this gargantuan production is the fact that nearly all of Metropolis was actually built to scale with just a couple of miniaturesTrivia tidbit actress Brigitte Helm was cast in the dual female role largely because she was flatchested and therefore she could easily fit inside the mechanical suit for the Robotrix A more busty actress would have suffered constant discomfort inside those galvanised bosoms of the metal costume I learnt this more than  years ago from an eldery Austrian stagehand who worked on the filmFor all its flaws Metropolis will always be my favourite movie Ive enjoyed writing all these reviews for IMDb The joy of posting my reviews on this site has brought me many friendships and a few enemies Well you cant win em allNitrate film stock doesnt last forever and all good things come to a happy ending This is my last review here Ill keep watching movies but other passions are important to me as well Thank you IMDb and thank you to everyone who has read my reviews I will happily rate Metropolis a full  out of ,10
11,One definitely cant fault the breadth and ambition of Fritz Langs vision even if as always with depictions of the future there are a few forgivable blind spots The cars that swarm up and down the multiple levels of Metropolis are unmistakably the standard models of the s as are the flyingmachines that buzz about them; while the business dress of tomorrows rulers unlike their exotic leisure wear doesnt appear to have advanced one iota!HGWells criticised the film for its adherence to arty image over scientific rigour and as a piece of coherent science fiction its certainly as lacking as he claimed The machines exist to appear awesome and to torment their workers rather than to perform any apparent task and there is no explanation of how this society functions how it evolved or how it is sustained let alone of the incongruities that must surely lie behind such anomalous locations as the catacombs and the cathedral But Wells own futuristic film Things to Come conceived in direct riposte to Langs unscientific approach is tedious and talky as a result didactic in its heavyfooted philosophy and explanations and lacking in artistic vision Metropolis may be soft SF but its approach undoubtedly makes for better cinemaI am not however impressed by it as a film Masterpiece of Modernism it may be  but great design and special effects cant save todays bigbudget clunkers from deficiencies of character and plot and they dont save this one Ironically I suspect that its reputation has benefited greatly from its being the only silent film many of its viewers have ever encountered reading through the IMDb pages I see wellmeaning comments like Great  when you consider how primitive cinema was in  and once you get used to the fact that it takes about ten gestures to convey one sentence It wasnt  and it doesnt!As silent films go this is in many places agonizingly slow and repetitious marred by clumsy acting tendentious titles and overwrought gestures By the late s cinema had progressed far beyond this laboured pantomime in Langs case the heavy stylisation may have been a deliberate choice but compared to the fluidity of contemporaries such as Sjostroms The Wind or The Scarlet Letter Asquiths Underground or Shooting Stars and Murnaus Sunrise the film comes across as ten years behind the times The problem is not necessarily with the actors  Brigitte Helm as has been observed does an excellent job in differentiating her two characters  but with the direction and pacingWe saw the restored version with the original Gottfried Huppertz score; the latter didnt always seem to fit too well with pops jumps and awkward silences but this was I assume due either to the difficulty of fitting it to allow for the missing material or to problems in the projection booth when running a newlyarrived print for the first time However the painstaking summary of the various missing scenes only ended up increasing my appreciation of what a good job had been done in the editingdown in the first place! To take a single example where the edited version conveys Freders sudden recollection that he is supposed to be the workers longawaited mediator via the simple juxtaposition of three shots  the shiftchange whistle announcing the meeting the catacombs and Freder suddenly struck by an idea and rushing off  the restoration betrays the fact that a couple of scenes of mimed dialogue were originally provided to spell out the message at painstaking lengthIt is interesting to see how it was done but most of the cuts are either an improvement or a very clever abridgement and by and large I didnt feel that what was omitted had been any great loss In fact frankly I felt that the film was in need of further editing at certain points such as Rotwangs pursuit of Maria through the catacombs She screams and runs and screams and runs and is pursued by a searchlight effect; its clever selfconsciously clever the first couple of times but the repetition becomes tedious to the point of caricature Plot infelicities abound in increasing numbers culminating in the infamous Hunchback of Notre Damestyle ending where the mad scientist carries off the girl across the roof of the cathedral hotly pursued by Our Hero which raised giggles in a hitherto serious and respectful audience with which I couldnt help but sympathiseThis is a film to see once in a lifetime so that you can say that you have seen it  not least because most of the impact lies in the visuals But its all surface and no substance the characters act arbitrarily the plot is subservient to the Message the pacing is like treacle the storytelling technique is primitive and really all it has going for it is the visual flair and the special effects I quite honestly believe that this work would be better appreciated as a set of stills in a glossy brochure; an exhibit in a design exhibition This is not cinema as I love it  its innovative it may be Art but as an actual film its only a poor shadow,6
