,commnets,Rating
20,I first saw Gone with the Wind in its initial commercial TV broadcast in  I have since seen the film numerous times via a succession of home video media videotape laserdisc and DVD Yet seeing the film once more on bluray and a large widescreen high def monitor is like seeing it completely anew The sweeping cinematography of this classic epic film has never before been delivered to home audiences in such stunning power and detail The achingly romantic score has never sounded better whether heard in original mono or reconstructed stereo Rhett Butler Clark Gable has never looked more rakishly handsome nor Scarlett OHara Vivien Leigh more alluringly sensual In short for anyone not having seen Gone with the Wind in glorious bigscreen Technicolor almost all film viewers under the age of  the recent bluray release is a mustsee revelationBeyond the compelling audiovisual experience Gone with the Wind thankfully retains its fascination as a central piece of American popular culture  a work of art complex and rich enough not only to bear up under multiple viewings but to reveal like great literature different aspects of its meaning depending on the cultural and personal variables that a viewer brings to the experience There were certainly a great number of impressions in my recent viewing that I dont remember having in quite the same way   or even  years agoFor one thing characters and character relationships impacted me much differently than in the past Scarletts multiple marriages and affairs – even the protracted love/hate odyssey with Rhett – seemed less interesting now than the strength of character that enables her physical survival and success as a business woman In many ways Scarlett is clearly not an ante and postbellum Southern belle but a woman of the s newly emerging from a patriarchal culture and acquiring a social role and status equivalent to a malesAs with other s films that touch upon the redefinition of female roles Scarletts acquisition of masculine power is greeted with ambivalence or downright hostility Even Rhett who is generally bemused by and attracted to Scarletts unbridled selfinterested power grabs eventually tries to tame and dominate Scarlett via marriage On one occasion he tries to persuade her to give up the lumber mill and become a more devoted mother to Bonnie Blue On another he compares the heartless Scarlett unfavorably to Belle Watling another hardheaded businesswoman but one whose ancient profession is considerably less threatening Ultimately Rhett attempts to assert his masculine power by an act of sexual aggression for which he would today be subject to domestic rape charges Amazingly given the era in which the film was made nothing works for long Scarlett is indomitable and irrepressible Unlike other s heroines Scarlett is NEVER reduced to a subordinate role In the end Tara and the screen are hers and hers aloneAnother thing that struck me in my latest viewing of Gone with the Wind was how much its creators particularly David O Selznick strove to temper the racist content of the story materials Of course they were unsuccessful from todays perspective but when the film is compared to Birth of a Nation the original film epic of the Souths secession and destruction one can clearly see its progressive designs First of all glorification of the Souths rebellion is tempered from the outset by the dissenting voices of such otherwise dissimilar characters as Rhett and Ashley both of whom foresee that the South has written its own ticket to destruction by entering into a war it cannot possibly win and for an historically dubious cause Notably the two central male characters view slavery askance Rhett is never a slaveholding gentleman And Ashley who is the scion of slaveholders reveals plans to free the Wilkes slaves upon the death of his father Moreover the slaves on the Tara plantation while still subject to stereotypical treatment are far more prominent and rounded as characters than in any previous American film intended principally for white audiences This is particularly true of sagelike Mammy of course but not only of herThe stark differences between the Mitchell/Selznick version of Civil War history and DW Griffiths can be seen most clearly in the postwar Reconstruction period In Gone with the Wind the really ugly stereotypes of empowered blacks are absent with the negative focus centering instead on white carpetbaggers Even the threats to Scarletts Southern Womanhood come not from renegade blacks but first from a white Northern deserter and later from white scalawags in Shantytown a locale that Scarlett intrepidly if foolishly ventures through From this latter threat she is pointedly rescued not by chivalrous whites but by her former slave Sam who beats off the wouldbe rapists and drives Scarlett safely home What a far cry this is from Birth of a Nation where Little Sister throws herself from a cliff rather than be raped by a former slave who has stalked her through perilous woodsAbove all Gone with the Wind deliberately avoids all mention of the Ku Klux Klan the terminally embarrassing heroes of Birth of a Nation The only scene that comes close to a Klan allusion occurs following the attempted assault on Scarlett when Ashley Dr Meade and thenhusband Mr Kennedy set about clandestinely to clean out the scalawags Yet even then their targets are not primarily black nor do the avengers don robes The audience is not even permitted to witness the attack – only Ashleys wounds from itIf Americans in the st century can still respond to Gone With the Wind  and clearly they can  it is not only because of its grand pictorial displays and epic action but because in terms of gender and race this classic of Hollywoods  peak year looks forward to a modern tomorrow as much as if not more than it laments a tragically flawed American past,9
21,I was dating at the time this came out in a small theater on Hollywood blvd for a short run Me and my girlfriend decided to see a movie and chose this one not knowing anything about it We sat in the balcony and was immediately captured by the music characters storyline and each other as we watched what we thought was a memorable night out together Unknown to me when part one ended I thought the movie was over and remarked boy that was good but I wonder what happened after that We got up to go and found out it was only intermission I cannot describe the feelings of joy knowing there was more We were not disappointed either When it ended I felt totally satisfied and changed forever more A great movie with my future wife locked into each other for our lifetime Since then I have seen this movie so many times never tiring of it I bought the collectors sets vhs and finally the DVD Just finished watching it again loving every moment until the end Will I see it again? Why not after all tomorrow is another dayGood movie to eat with while watching,10
22,I love this film I have seen it a handful of times and even though I am always a little frustrated by the stubborn pride of the two main characters I can never dislike it True Scarlet OHara is a foolish woman who believes she is madly in love with someone elses husband but she is just as bad as the proud Rhett Butler who loves her through it all Their problem is admitting their true feelings deep down and in this small selfish act is where we find the heart of the story and its timelessness We all love that great timeless love story despite its tragic ending and Scarlets tenacity for surviving and keeping her family alive even if it did involve tricks and schemes on her part Despite all this the film managed to capture the heart of Americans everywhere and even those hearts of the generations that followed That is the true power of this film Aside from being able to enchant its audiences Gone With The Wind was truly a groundbreaking film in American Cinema It was one of the first major films that came out in vividly welldone color not only that but the photography was phenomenal also Much more can be said about this film but for now all I will say is this Fantastic film worth the  hours,10
23,I waited  year before even considering watching Gone With The Wind Four plus hours long? ? It was as old as my Dad But finally in a desire to see all these classic movies I sat down to watch itsince then and before writing this review I have now seen it three times Gone With The Wind is quite simply breath taking It is brilliant and captivating and perhaps one of the greatest epics you will ever lay eyes on Some people consider Gone With The Wind to be the greatest film ever made and its pretty easy to see why Especially if you factor in the time period this was made the special effects the sheer grandeur of it is impressive NOW let alone  years ago The raging war the fields being worked the attacks being carried out the people evacuating and the beauty and horror of the south during the civil war Add onto that this incredible unmatched chemistry between the romantic leads and youve got one incredible epic that defined epic before it even existedVivien Leigh is Scarlett OHara One of the most influential and recognizable characters in movie historyprobably top  Leighs Scarlett will remain in your memory forever Her character goes through so many changes and at times you literally despise hershes whiny and needy and mousy and then in the next breath you see this incredible strength and wisdom and this ability to make her such a hero Shes a strong female lead and her performance is amazing Scarlett OHara is one of the greatest characters in movie history Clark Gable as the irrepressible Captain Rhett Butler At first I thought Gables performance lacked depth I thought he came across as a movie star there to show off his stuff but then as the film progressed I began to see what Captain Butler was all about Rhett Butler had this air of overconfidence a macho party man with nothing holding him down including political ties His reputation as a drunkard and a rich bachelor suited him fine Then Scarlett comes into his life and he falls hopelessly in love with the most unlikely girl that plagues him for the years and years Gable is a master and looks incredible on screen and shows why men of his era were leading men the likes of which weve never known He definitely deserved his Oscar Nomination for the role The supporting cast is so huge I could go into detail on every single one of them They all do an incredible job including the first African American actor to be nominated for an Academy Award Hattie McDaniel who is just wonderful as Mammy their beloved house servant Leslie Howard as Scarletts love interest for years and years Ashley Wilkes Olivia de Havilland was one of my favorite supporting roles as the loving and kind Melanie Wilkes who marries Ashley away from Scarlett She was terrific in her role one of the best characters in the film Harry Davenport Thomas Mitchell Barbara ONeil Butterfly McQueenso so so many other terrific performances in this film Also watch for uncredited and small roles by future stars George Reeves Superman and Richard Farnsworth The Straight Story/Anne of Green Gables For years I havent been a fan of old classics Just now am I getting around to watching them but if youre the same way put that aside and see Gone With The Wind Its LONG there is no doubt about it but its utter brilliance story action romance and just everything about it will keep you absolutely riveted I now completely understand why people consider this one of the greatest films ever made if not THEE greatest I dont know if I can say that exactly because I have my own list of favorites for different reasons but I will say Gone With The Wind is perhaps the exact definition of a classic and worthwhile from beginning to end One of the greatest films I have ever seen and I will be sure to add this to the list of movies I watch again and again /,10
24,Over the weekend I was given the opportunity to see Gone With The Wind in theaters with my parents for its th anniversary Its kind of embarrassing to me that I a selfprofessed lover and at this point addict of cinema hadnt yet seen a movie that is universally considered one of if not THE best American movie ever made Part of me had always been turned off by its  hour runtime as I am in college and dont often have the time to sit down and watch a movie in a single hour sitting But another part of me had shied away from Gone due to all the blatant racism in it that I had been warned of I had wasted my time watching DW Griffiths epic The Birth of a Nation and did not want to sit through another slog of a film that is great technically but ruined by its subtext So when I sat down in the theater I was hesitant but excited And yes Gone With The Wind is undoubtedly racist but it is also so much more and the fact that it can be both great while having all of its apparent flaws is the very reason why it is undoubtedly a classic,10
