,commnets,Rating
12,This movie is so intense and enthralling it doesnt have to hide from even the most amazing Actionmovies But unlike the most actionmovies it really has a story to tell with a very interesting conclusion at the endWhen people talk about Fritz Lang they always talk about Metropolis but I think this is his masterpiece This movie MUST HAVE inspired pretty much every police movie or show ever made Rarely have I rated a movie a  with more confidence than this oneEND OF REVIEW so I dont have anymore lines but they make me write  lines apparently so Im writing this I know a joke ehm well its not a good one so I will quote GEORGE BESTI spent a lot of money on booze birds and fast cars The rest I just squandered,10
13,Watching Fritz Langs M is watching the history of cinema unfold before ones eyes Made in the transition period between the silent and sound film this  masterpiece remains fascinating for several reasonsFirst of all the use of sound is impeccable Suffice to say the killer in the movie is caught is through identifying his trademark whistling But the use of voiceover narration was also new at the time and is used here very well first when a mother calls in panic for her missing child and her name echoes across several empty walls Next in a scene in which two detectives elaborate on what theyve done to apprehend the killer and everything they say is matched by an imageSecondly few times has a serial killer been treated with such complexity compassion and straightforwardness in cinema Peter Lorre plays a child murder a man who acts by impulse possibly a schizophrenic He simultaneously evokes horror and pity and hes too distant from the supercool and erudite serial killers of today Lorre plays one Hans Beckert a lonely man with a history of mental illness an ordinary man without any qualities or amazing traitsThirdly its a powerful meditation on vigilantism and crime The police is unable to capture the killer so Berlins underground decides to capture the criminal The police raids are putting them out of business and they resent the fact that a child killer is being sought amidst their ranks The absurdity of bank robbers and card cheaters with a sense of morals is not lost on the filmmakers In a mocktrial at the end these same criminals think they have the authority to sentence the child murder to death But as he tells them if they wanted if they got jobs and worked honestly they could leave their lives of crime; a man whos ordered by voices to kill cant just turn off him impulsesBut above all M is a fascinating exciting thriller Its an intelligent crime story that shows police and criminals working on different sides and with different means to achieve the same purpose If one can laugh at the idea of a criminal union realism should never be a criterion for judging art one cant laugh at the policemen in this movie Inspector Lohmann played by Otto Wernicke is one of most intelligent detectives ever to grace cinema Hes fat hes cranky hes an unlikely hero but hes shrewd he can read a persons personality at a glance hes patient Lang must have liked him too because he used the character and actor in his following crime epic The Testament of Dr Mabuse in which Lohmann shows even greater skillsI knew or at least highly expected that M would be an amazing movie But I didnt imagine a yearold movie would hold up so well in terms of cinematography sound pacing acting structure Few movies achieve such a synthesis of qualities There is no doubt on my mind that M deserves the recognition it continues to receive from film historians,10
14,In my opinion this is just an OK film Except for some little stylistic tricks there is nothing special The story is OK how it is told is rather weak in some parts its even ridiculous the acting is mostly very weak except for Lorre who you dont see much of anyway and the sound quality is horrible something you cant blame it for but I had to use HEADPHONES on full volume to even understand the words! but switching from sound to silent all the time is very distracting and has no dramatic effect at all even if some say so  the opposite is the case it seems very amateurish The slow pacing is typical for its time And suspense? I dont think so In my opinion the main reasons why this film is so critically acclaimed areA Lorres overacting Whenever overacting has a purpose its critically acclaimed And his acting as a madman is very effective B Id call it heavy look The topic seems heavy and the plot and style seem all too heavy and important You almost want the film to be successful so you search for it in Lorres acting As a justification so to say Im sure you like the film for many other reasons too Some more important reasons maybe But that doesnt mean Im wrong Its a film we want to like and where you dont want to look for the flaws Well long story short I dont think the final result is a success There is too much Average in it and the Great isnt all that great Metropolis Nosferatu Caligari Sunrise I think have all a more stunning look All silent and all made before M Dont get me wrong the cinematography is good and also inventive in little parts but not THAT revolutionary that it deserves the reputation it has Probably the flaws are too big for me to fully appreciate the rest Like every time one said He doesnt leave any marksblah blah I had to laugh He talks with the kids in the middle of the day in the middle of the street he walks along the streets with them he goes into shops buys stuff for them he makes mad gestures in public And then he also whistles this damn song all the time so loud you hear it from three streets away while everyone in the audience knows from beginning on that this will be his doom /,6
15,While many of the problems of early sound pictures lampooned in Singin in the Rain were more or less myths the early talkies did present a big challenge for filmmakers everywhere Europe however was at an advantage over Hollywood because even though it took them a few years to gain the same access to sound technology films from the US would be screened abroad only six months or so after their first domestic release Thus directors like Fritz Lang were able to witness Hollywoods first faltering steps with sound before giving it a go themselvesIts funny how sceptics dismissed sound as a gimmick because the best early uses of sound were those that treated it as exactly that – a gimmick Lang demonstrates in M that a talkie need not be an entirely new kind of motion picture; sound is merely another layer of technique Rather than getting bogged down in lengthy dialogue scenes Lang keeps his storytelling primarily visual and when he needs lots of expository dialogue he intercuts multiple scenes to keep the pace going This is not to say Lang is trying to ignore sound – in fact he uses it to enhance the picture sometimes having dialogue or other noises take place offscreen to focus us on reactions or causeandeffect Other times he ironically uses completely silence something of course you never get with silent pictures due to the continuous musical score giving a dreadful sense of eerinessAnd thankfully the best elements of Langs method have survived the talkie revolution His visual style is particularly effective here in provoking a chilling disturbing atmosphere Shot compositions with large blank areas give a sense of surreal starkness Characters often stare intensely straight at the camera aggressively drawing the audience into the films world Several times we are even dumped straight into the pointofview of the killer himself The fragmented narrative with its lack of lead characters and impersonal pointbypoint plotting could easily be boring but Lang holds our interest by keeping a dynamic sense of rhythm and telling the bulk of the tale through pure wordless imagery Langs German pictures in common with typical German cinema of the time feature highly melodramatic acting and exaggerated almost comical characters These figures generally suited the fantasies and comicbook stories of Langs silent days but Im not sure they sit so well with the closetohome setting of M Still these characters are somewhat more effective now that they have voices probably because most German screen actors of the day were from a stage background Peter Lorre was a shameless ham but thats what you need to play a psychopath and in any case hes a lot better here than in many of his Hollywood roles Otto Wernicke is also incredibly entertaining in the role of Inspector Karl Fatty Lohmann; again a stagy exaggeration but with some absolutely wonderful gestures and comic timingThere isnt a lot else I can say about M – it is one of those pictures that has been analysed to death – although I doubt any comment other than mine mentions Singin in the Rain in the opening line  While not quite Langs best picture I can think of few directors who made such a smooth transition from silents to talkies and sadly this was his penultimate German picture before the Nazis took over Theres no denying that Lang was wasted in Hollywood He did his best to understand it but by and large it never understood him I say by and large; the renowned Irving Thalberg was reportedly bowled over by M and screened it to many of his writers and directors as inspirational material Had that prestigious and influential producer not died in  the same year Lang began working in Hollywood would things have turned out differently I wonder?,9
16,Masterpiece is the word most film buffs and historians probably would use to describe this  Fritz Lange film based loosely on the events of a reallife serial killer a few years prior to the film In this movie the killer is Hans Beckert Peter Lorre who lures children to their deathsThough the story is about a child killer the theme of M centers more on societys obsession with the murders From kids playing games to adults going about their everyday lives everyone is on guard suspicious combative and very vindictive For selfish reasons even the petty criminal underworld wants the child killer caught But the police are ineffective and a selfrighteous mob mentality takes over The whole film is really a study in the terrifying psychology of group thinkAs it turns out the killer is less monstrous than pathetic and compulsive Beckert cant help himself Hes a short squatty bugeyed little man who cant control the devil within Lorre was perfect for the role and his acting is flawless and mesmerizing Yes the killings all offscreen are awful But the militant lynchmob mentality is just as scary Beckert is the only individualist in the filmPart silent film and part talkie the B&amp;W visual style of M is wonderfully expressionistic and baroque There are lots of overhead camera shots Background sounds like honking horns and whistles are precursors of major plot pointsWhat strikes me most about this film is its tone I can think of very few films that are so harsh so bitter so malicious so punitive M contains not an ounce of humanism Langs exwife Thea von Harbou a Nazi sympathizer wrote the film just before the rise of Hitler The films angry militant tone thus foreshadows Hitlers Third Reich from  until  Lang himself fled Germany and ended up in the USYour own personal preferences in films will determine whether you consider M to be a masterpiece or overrated or perhaps somewhere in between But individual preferences aside there can be no doubt that M is an important film historically Every person who wishes to be versed in classic films needs to see M at least once,0
17,A serial killer who favors children Peter Lorre is on the loose in Berlin He is wanted by the police But even worse for him he is wanted by the Berlin underworld who have been targeted falsely by the police for being involved Watch out child killer! There is nothing bad I can say about this film The acting the directing the sound all perfect Many have praised Lang for his use of sound at a time when the practice was just coming into play And rightfully so Whereas other films have sound matching what is on the screen Lang realized he could use the effect to signify what he was not showing including the murderer who has a distinctive whistle Brilliant Not to mention that one key role is a blind beggar a man who cannot appreciate visuals but only sounds he is appropriately the man who can identify the killer! Basing the story loosely off of childmurderers of the day Grossman Haarman and Peter Kürten this is one of the darkest tales set to film up to this point There is no blood and no children are actually seen killed And the killer is relatively reserved compared to his reallife counterparts who were also rapists and cannibals He presents an interesting defense his crimes are less wrong than the crimes of others because he cannot psychologically control himself Or in modern terms not guilty by reason of mental defect Is a child killer less evil than a pickpocket? Is he in some way also a victim?I enjoyed the idea of a unionized underworld I do not know the reality of this as it seemed sort of comic and anticipated such villainous teamups as we might see in comic books But crime was certainly not unheard of and even black market meat existed and I am not sure if I really want to know what that meansMany including reviewer Stanley Kauffmann have noticed the similarity between M and Bertolt Brechts Threepenny Opera Sadly I have not seen Brechts work and cannot comment on the comparison German philosopher Theodor Lessing best known for his work on Jewish selfhatred may even have been an inspiration due to his work on Haarmann But regardless of inspiration Lang is the master here his work stands the test of time and today almost a century later is widely recognized as one of the greatest achievements on film At the least many consider it the alltime greatest German film And rightfully soThere are so many great shots including the socalled inventory shot of the criminal underworlds wares Lang also excelled with the camera angles using knives as frames and getting more than one great mirror shot I should also give credit to cinematographer Fritz Arno Wagner who previously worked on Nosferatu and many others  his reputation should be second only to Karl FreundThere is nothing that beats the Criterion release with commentary short films and more I watched the film this way on DVD Perhaps a Bluray release has even more but I would not even know what could be added This disc is packed and a mustown for any film historian or Lang fan,10
18,Outstanding German expressionist film from Fritz Lang that follows first the police then the underworld as they search for a child killer in Berlin The cinematography is moody and dramatic as the story moves through the poorer sections of the great city and the acting while of a more melodramatic style than is currently popular is very good* Peter Lorre is outstanding as the killer who taunts the police as the noose slowly tightens around him To some extent the film is an early procedural drama as the police use then modern forensic techniques such as finger printing and graphology to try and find the killer Tired of the increased police surveillance the citys criminal element begins their own search mobilising the numerous beggars to be eyes on the street The film touches on a number of issues that are as relevant now as in the s including mob mentality men are accused of being the killer simply for talking to a child rights of the accused the end justifies the means use of torture and the ever thorny issue of mental health and culpability One of the great preWWII German films *I watched a subtitled version on TCM,10
19,M like Manichean? What can you say of a plot driven by criminals and where good people are rather inefficient for the most part and where the most despicable character earns our own sympathy This is a movie using such stark blackandwhite contrasts noir in its soul and gray in its coreM like Mob Mentality? Fritz Lang personal Jaccuse against a system where accusers arent all innocentM like Maturity? The film also consecrates German Expressionism as a peak of creativity and social relevance a sequence in history where Berlin became literally the best area and arena of expression to an art that had reached its maturityOr M like Mörder murderer in German Maudit in French doomed and Masterpiece in the universal language of cinemaM like Menace and MusicChildren are singing an elimination game of ominous undertones later we see little Elsie playing with the balloon a shadowy silhouette appears the face remains unrevealed while we hear the whistling of In the Hall of Mountain King Before the shark theme in Jaws to the Psycho shrieking violins the Peer Gynt tune became the first notable leitmotif meant to suggest an evil presence the perfect device to put us in the victims standpoint for the first act as powerlessly as the poor mother calling Elsie while her balloon the bait used by Hans Beckert is drifting along the telephone wiresThe effects are then shown through the growing fame of the new Jack the Ripper figure the ensuing paranoia with any adult basically talking to a child is assaulted The killer is a menace to an already crisisstricken society forcing the police department to triple the efforts psychiatric cases are explored handwriting analyzed and daily and nightly raids operated to make further pressure on the criminal worldM for Methodic For its second act M is the seminal police proceduralWhile covering that angle with a documentarylike precision Lang still seems dubious about the polices efficiency and provides an interesting twist by paralleling the work of the law with the outlaws In a long sequence where both sides brainstorm about the methods to use to find him we swing back and forth from one world to another and the only indicator of the side of the law were put in is the presence of uniform last time I saw criminals acting like politicians in a masterpiece it was in The Godfather One even points out insightfully that the killer must be a bourgeois because its the very standard of life that provides the level of idleness driving any easily corruptible mind to the most extreme cornersM like the sign on the shoulderSo in a famous sequence criminals helped by the street beggars find Hans Beckert quicker than the police force he was betrayed by his trademark whistling and irony a little girl who noticed the infamous letter marked on his shoulder The following chase takes maybe too much time for the films own good Not saying the film could do without the struggle to catch him but the court is such a high point of cinemas history that the previous part seems more forgettableAnd Peter Lorre with his round face innocent eyes when hes cornered like a rat and utters his memorable speech gives the performance of a lifetime as a living symptom a man incarnating the sickness of a society where bad people toy with justice and the worst of all acts as childishly as his victims claiming innocence with such rabid eloquence hes almost convincingBeckert says he cant control his impulses a little voice urges him to commit the irreparable acts and his body language is simply gutwrenching when he simply cant put words His lawyer makes a good point about the past of some accusers whose Becket call hypocrites because they could choose to be honest but the accusers retort that whether hes responsible or not hes still a menace Sure whether their reasons are selfish or ethical is debatable but can we empathize with Beckert?M like ModernityLooking at Twitter or Youtube or Facebook comments today you can tell theres something ferocious and still ongoing about mob mentality and a film like M could be deemed as feeble and liberal in the way it provides a tribune to a child molester the worst possible crimeM like MultilayeredYet there are some powerful truths hiding underneath the thriller the truth about a society sick of its own contradictions determined to impose standards of morality white and condemning true crimes black but indulgent toward activities that have no worse repercussion That the film ends with blackclad mothers admitting their own responsibility is perhaps the most optimistic thing about M the sentence doesnt matter what matters is the lesson behind but did German learn the lesson?Ironically one could have seen the rise of the Nazi empire as the antidote like Thea Von Sarbou who wrote the film and worked for the Nazi regime other could also see it as its worst possible consecration like director Fritz Lang That he didnt side with the criminals at the end emphasizes an intuitive comprehension of his world and allowed this film to be hailed as a true intelligent nightmarish and alas premonitory masterpiece with M as the mark of a disillusioned geniusM like Meditative? Mysterious? Mantic?Interestingly the French title is M le Maudit meaning the doomed one as if Beckert was the living incarnation of a doomed society as if there was indeed something rotten in the Weimar Republic and It wouldnt get any better after but could Fritz Lang anticipate it? Looking up his second masterpiece M I was wondering whether Lang reflected his own rejection of German society or cared enough to warn the audience against the impending doom of decadenceSurely the director behind Metropolis could only pinpoint with the accuracy of a soothsayer the limits of a civilization that might take its heritage for granted,9
20,This movie has it all! This is one of my alltime favorite movies Many people have criticized it because its from  and I say Who cares when you have such a great movie? Peter Lorre gives a  star performance as the child murderer and may I say he is very very haunting Fritz Langs direction is superb; the cinematography is superb! The kangaroo court scene at the end is my favorite part and its brilliantly done The plot is very well crafted Even more amazing is the plot focuses around catching the murderer but it is not boring for one second Each scene flows beautifully into the next with some amazing chases raids and facial expressions This is also a movie ahead of its time This is definitely one of the alltime best movies!,10
21,Fritz Langs second absolute landmark after the equally brilliant but completely different Metropolis and also his first opportunity to work with the wonders of sound And boy did he ever deliver a great piece of work! Like the M for murderer is marked on Peter Lorres coat the film M for masterpiece is branded on cinema history annals for all eternity Langs film is a triumph in every possible viewpoint and it covers a lot more genres and elements than just simply the manhunt for a childmolester*** SPOILERS ****The horrors M handles about is timeless and of all cultures but yet itll always remain a taboo subject and for that reason alone Fritz Lang deserves extra praising In an utterly astonishing way Peter Lorre portrays Hans Beckert a child murderer who singlehandedly terrorizes four and half million people simply by his uncontrollable urge to kidnap and molest young schoolgirls The grim and haunting atmosphere is terrifically built up by images of previous Beckertvictims and the disappearance a new unfortunate girl Her toy rolling of a remote hillsa balloon drifting away on the wind Really simple but extremely efficient methods to reflect the ominous actions that just took place Other than to focus on the further actions of the killer Lang turns to the effect this terror has on the city and how the manhunt for Beckert develops Our director is obviously fascinated by how a police procedure is organized and he serves the viewer a detailed overview of all the steps taken by the investigators Meanwhile he grabs the opportunity to forcefully criticize the medias influence and the German law system with both hands Id really like to stress that Langs subtle mockery was a really risky thing to do with the upcoming Nazireign so you cant admire him enough Due to the constant and fruitless raids the police are holding in the hope to capture the killer the criminal underworld begins to lose its profits as well and they start their own manhunt for the killer assisted by whores beggars and petty thieves With the carefully observing eyes all over town it becomes practically impossible for Becker to satisfy his monstrous needs The almighty Peter Lorre arrives late in the film every moment hes on screen is a moment worth treasuring His sad appearance and cruel testimony are sequences that leave no human being unmoved Lorre is a brilliant actor and this is inarguably one of the most impressive performances of all time M features constant tension outstanding dialogue and stunning camerawork As said before Fritz Lang had the opportunity to work with sound for this film and he immediately makes the most out of this This was the first big German production that featured sound and it STILL ranks as the title that made best use of itand that sure means something after more than  years Theres the chilling and legendary tune Lorre constantly whistles but also the absence of sound Lang uses to portray the besieged city As you can tell from the above review M is absolute mustsee and easily one of the most essential productions ever shot Its lightyears ahead of its time and still disturbing after all these years This film is a mesmerizing portrait about the darkest most alarming aspects of humanity and yet still it doesnt live up to reallife facts As you probably know the plot of M is based on the whereabouts of the serial killer Peter Kürten who brutally murdered many victims in the city of Düsseldorf I read a biography on Kürten recently and the true details of his crimes and animallusts go beyond every filmmakers wildest imagination,10
