,commnets,Rating
12,There can be no understanding between the hands and the brain unless the heart acts as mediator This is the predominant theme of Metropolis and director Fritz Lang finds numerous ways to say and visualize his message during the course of the film The movie relies on repeated visual imagery to make its point and does so effectively even if tedious at times Particularly effective is the representation of the worker society as an almost single living unit moving trance like to their appointed time and task The use of a ten hour clock in the workers chamber constantly draws our attention as does the hangdog posture of the individual slaves who grind out their workday as if in a dazeAmid this rabble worker Maria Brigitte Helm is the inspirational voice of the workers offering hope for a brighter future by a mediator yet to appear However the Master of Metropolis John Frederson Alfred Abel sees in her a way to quell the underlying frustration of the workers commissioning his scientist Rotwang to create a robot Maria to plant discord among the workers Rotwangs laboratory would have done Frankenstein proud and the creation of the robot is a marvel of cinematic imagery The robot Marias belly dance transforms into a scene of such raw energy and sexual awareness that it awakens the statues of the Seven Deadly Sins one of the master strokes of this expressionist filmSo much imagery in fact is layered into Metropolis that its safe to say that repeat viewings will lead to even more interpretations of its vision and not simply for its denunciation of a class society Both timely and timeless the film captures a dynamism that inspires passion even after nearly eighty years following its original release,8
13,I really hate it when I dont enjoy a classic film I really want to enjoy it but I just cant I want to understand some peoples love for it but I just cant Metropolis falls under this category An unbearably slow film I watched the restoration which is over  hours longthat may have been a bad idea that starts off with interesting ideas but then seems to not really do much with them It is the year  the wealthy rule the city of Metropolis while the lowerclass work for hours on end underground in awful conditions The Master of Metropolis is Joh Fredersen Alfred Abel and his son is Freder Gustav Frohlich who spends his days with other rich people in a place called the pleasure garden where he truly does nothing at all A woman named Maria Brigitte Helm brings a group of working children up for a visit in pleasure garden and Freder is quickly enamored by Maria Freder decides to explore the underground part of the city only to be shocked as an explosion goes off and kills multiple workers He reports this to his father who is disappointed his son was the first to report it over his assistant Josepha Theodor Loos and his assistant is quickly fired This does an immediate job of showing the coldness of Joh but they never do much else with his character In fact very little of the characters are developed in anyway Most of them are completely uninteresting and the setting itself is compelling at first but quickly loses anything interesting halfway through the film as the film moves at a snail pace Anyways the main aspect of the plot here is that the workers are led by Maria to stop this feud between the rich and the poor with nonviolence and the eventual arrival of a mediator to make it happen My real issue is that the film starts with such a great idea and had potential to become something like  Im aware it came out afterwords and that its a novel but still just an example but it instead becomes filled with strange religious allusions and becomes a witch hunt essentially by the end They never really do any decent social commentary at all If any at all This wouldnt matter if the film was actually entertaining but it only is in spurts and then quickly becomes a repetitive bore I do think the special effects were impressive and this film is obviously important for being the first full length science fiction filmwell ever That doesnt mean it holds up because it doesnt In fact itd be hard for me to believe the film was entertaining in  I still wonder if I had watched the shorter version of the film how much more I wouldve enjoyed the film It certainly wouldve have been paced better considering so much of this film is unbelievably uninteresting But I dont think that changes the fact that this movie doesnt really do anything It isnt entertaining It doesnt really have a message What is this movie? I guess good special effects for ? Whatever Im glad I gave this classic a chance but I highly doubt Ill revisit it anytime soon,4
14,This review contains Spoilers But since the story is by far the least reason to watch Metropolis feel free to still read it even if you havent watched it yetMetropolis is a film that was far ahead of its time It influenced a great lot of sciencefiction films and how The Blade Runner Batman or Dark City would look like if there wasnt Metropolis  who knows Even The Matrix Reloaded is heavily inspired by this classic that is as old as my grandmother Now what is it all about? About Freder the son of the head of the city of Metropolis a Christlike figure who falls in love with the preacher of the working class a saintlike woman who happens to be named Maria When a robot who is modeled to look like Maria makes the workers almost extinguish their city and their children Maria and Freder save the children and in the end Freder makes his father and the workers cooperate for a brighter futureSounds silly to you? Yes and thats exactly what the story is silly Thats also the reason why still today Metropolis isnt accepted as the masterpiece it is by a few film buffs But these people dont understand one thing A good film does more than only tell a story A film can be great even without a story at all and a silly story combined with amazing visuals can make you forget all the other weaknesses a film has And wow what amazing images Metropolis offers What an art direction! What wonderful special effects! And remember as I already said this film is as old as my grandmother! Just have a look at the workers They hardly ever seem to be individuals In the mass scenes they look like one big creature moving forward or backwards When they are working they look more like machines than like human beings whereas the machines resemble monsters more than they do technical devices best seen in the moments when Freder hallucinates and sees the big machine as a workereating Moloch We also see a worker and later Freder work on a machine that looks like a clock with  blinking light bulbs doing some that looks as exhausting as it looks senseless Or think of Rotwang the mad inventor who lives in a little hut that looks in this film like it was from another world He has a black prosthesis for his right hand its not a coincidence that Stanley Kubrick gave his mad scientist/inventor Dr Strangelove a prosthesis for his right hand too He builds the robot that he makes to look like Maria and that transformation scene is one of the most magnificent scenes ever and looks more convincing than some scenes of modern scifi flicks I also have to mention Brigitte Helm who plays Maria and the robot  and the look in her eyes would already be enough to tell which of her characters is on screen at the moment If something like awards already would have been given in the s she sure would have walked home with quite a bunch of them And just look at her sexy dance! It is just as memorable as the shot of the many eyes watching her dance  or the many faces watching her preach just a few minutes later Metropolis is a film no scififan should miss I had the good luck that my first viewing of Metropolis one year ago was in a cinema when it was a rereleased after its restoration I can only recommend you to watch it in a cinema if you have the possibility to as Metropolis is just as   A Space Odyssey one of those rare films that are masterpieces on your TV set but a revelation on the big screen,10
15,I was very anxious to see Metropolis for the first time I had been into silent movies for a couple of years but hadnt had the opportunity to see Fritz Langs classic I finally saw it at a silent movie theater in Hollywood and my feelings were to say the least mixedThe film is visually stunning Monumental sets brilliantly directed scenes amazing special effects by the standards of the time In fact I might say that I was more enthralled by the visual effects of this movie than I was by say Lord of the Rings or Avatar Whereas Cameron and Jackson used CGI to make their visions come true; Lang had to use camera trickery paint and woodThis movie no doubt set the lexicon for the SciFi and blockbuster genre in stone The images of Metropolis have been repeated in innumerable movies The scene of the underground city being flooded has curious similarities to James Camerons Titanic Even the villainous Rotwang can be seen in the characters Dr Strangelove and Doc Brown from Back to the FutureBut then theres the story And the dialogue And the acting which is overwrought even by the standards of the time But I dont have enough room to go into thatStarting with the opening line LookThese are your brothers a violent cringe would run through my body every time the intertitles would appearThe later line about the head and hands needing the heart as mediator caused a huge outburst of laughter in the theater This serves as the basis for the moral of the story which was eerily similar to How the Grinch Stole Christmas Essentially it can boiled down to this Somebody according to writer Thea von Harbous later beliefs this turned out to be Adolf Hitler needs to appeal to the hearts of capitalist managers and tell them to be nice to their workers The outcome is a grudging handshake between the head manager Joh Frederson and the leader of the workers Grot; and thus begins a shining new day!Metropolis also incorporates religious symbolism which is to say the very least heavyhanded Scenes of the Seven Deadly Sins The Tower of Babel an altar to Moloch and the Flood all warn of doom to decadent societies that exploit the weak and kill the righteousIn the end this muddled mixture of Socialist calls for justice and Christian Apocalypticism creates a political message that Lang himself described as sillyI recommend this film for its artistic brilliance and groundbreaking techniques But dont go into this expecting an award quality filmIf you want to get into silent film this is a relatively easy one to get start with However I dont know if thats a good or a bad thing Ive met too many people whove said that Metropolis was the best silent movie theyve ever seen; which probably means that it was the only one that they ever bothered to watch I would recommend Sunrise or City Lights as a first over this,5
16,Francis Ford Coppola once said that Apocalypse Now wasnt just about Vietnam is was Vietnam In a similar way Metropolis isnt just about the Twentieth Century it is the Twentieth Century Almost every image in it reflects or more often predicts the realities of life in the West over the past hundred years in a way that is truly uncannyFrom small details  the traffic jams and blackouts that plague city dwellers  to major historical events  the climactic flood predicts every industrial disaster that has destroyed the lives of thousands of workers from Chernobyl to the Bhopal disaster whilst Fredersens vision of workers being fed to Moloch cant help but bring to mind the holocaust  Metropolis feels prescient in any number of ways In the image of the Manhattan skyline Lang really did find the perfect symbol of the coming century  progressive new faceless oppressiveThis is far from the simple Marxist fable it is often taken for  although the Socialist message can hardly be ignored Its also a Christian parable Maria flanked by crosses is counterbalanced by the Machine brought to life under a pentagram informed by the book of Revelation; a retelling of the Orpheus myth with Freder as Orpheus and Maria as Eurydice lost in the underworld; and a Kafkaesque nightmare of depersonalisation although the Gothic expressionistic production design is a long way from Kafkas more sterile styleIts also lest we forget a silly adventuremelodrama with a mad scientist an evil twin a bad father with a noble son and an impossibly virtuous idealised heroine In many ways it anticipates Star Wars in dressing up mythic standards with Science Fiction tropes  with Fredersen as the misguided King Freder as the handsome Prince Maria the goodhearted peasants daughter Rotwang as a scheming sorcerer and the Machine as the wicked witch appropriately burnt at the stake by the villagersThe MachineMan a confusing name for a construction so obviously feminine is the single most indelible image of the film; the scene in which Rotwang brings her to life for the first time is a real moment of magic and awe untarnished by eighty subsequent years of cinematic showmanship Even better is the scene in which she becomes a duplicate of Maria  such an obvious influence on James Whales Frankenstein that its hard not to shout out Its alive! The optical effects are years ahead of their time certainly the best of their kind until the sixties at least It also marks the beginning of Brigitte Helms truly extraordinary turn as the false MariaThis is only the third silent film Ive seen after Nosferatu and The Cabinet of Dr Caligari and its taken me a while to acclimatise to the acting style which can seem close to parody What it really reminds me of however is modern dance which similarly seeks to communicate with the audience visually rather than verbally Metropolis encourages this comparison with the highly choreographed movements of the workers operating the machinery Bearing this in mind Helm is hugely impressive in multiple roles Maria could be a rather dull and virtuous heroine she enters the film surrounded by poor children in rags but Helm invests her with enormous energy and expressiveness It helps that the script allows her to take an unusually proactive role for a female character organising workers meetings and racing to the rescue of the endangered children However it is her performance as bad Maria vamping up a storm that lingers in the memory  the twitching jerking movements of her head and body the Anne Robinson style halfwink that changes the shape of her face that malicious little grin that makes it hard not to root for her mischief The entirely weird erotic dance that she performs isnt technically very good or erotic but it is utterly unforgettable Subtextually shes the Whore of BabylonThe other performances are mainly very good particularly Alfred Abel as Fredersen proving that it is possible to underplay in a silent film Only Rudolf KleinRogge hits any wrong notes  difficult as it undoubtedly must be to play a mad scientist in a silent film with subtlety some of his more unrestrained gesticulations leave you worried about the safety of the other actorsUltimately though it all inevitably comes back to the imagery Langs film remains unmatched even today Pick a scene any scene  the synchronised shuffling crowds at the shift change; our first sighting of the Metropolis all biplanes skyscrapers and suspended motorways; the vision of Moloch; the MachineMan awakening; Maria pursued along a pitchblack tunnel by a beam of light; the statue of Death coming to life in the Cathedral; disembodied eyes entranced by the twitching false Maria; the crowds swarming up the steps in the Tower of Babel section; the lifts crashing down one by one; desperate children crowding around Maria as the floodwaters close in; and most of all false Maria laughing as she burns on her pyre then transforming back to her metal visage No film before or since matches this for spectacle And if in order to appreciate it you have to swallow a little treacle about the heart being the mediator between head and hands well trust me its worth it,9
17,We have seen so many movies now that even those of us who study them tend to forget where certain familiarities were born The science fiction elements presented in Fritz Langs Metropolis are so familiar to us that they have become not just the genre standard but almost a given The notion of a city as an urban hell ruled by the upperclass and operated by slavelike poor The notion of the city that seems to touch the heavens The notion of a mad scientist giggling in his lab as he plays God The lone hero who discovers the diabolical machinations of the villain and tries to throw a monkey wrench into his plan These elements can be found in this films ancestors Frankenstein Batman Gattaca and the cities of Blade Runner Star Wars and The Fifth Element All of these films contain elements that were inspired by Langs workMetropolis has gone down in history as one of the most influential films ever made certainly one of the most studied silent films and yet the movie sort of languishes After its success in  the film has had an uneasy time Its pedigree as a silent film turns off the usual science fiction audience and it is sort of a footnote in the history of the genre One restored version after another has tried to reconstruct the film as best it could because some of the footage of the film has been lost through neglect and silly studio censoring Some of the restorations work but most do not so we sometimes wonder what an experience this must have been like in  Unless a lost version surfaces as it did with the recently uncovered print of Valentinos  film Beyond the Rocks the complete work my never be seen again The restored version released on DVD in  was based on a digital restoration at K resolution from all available sources Its the best version that Ive seen and I would highly recommend that one if you havent seen the film The worst is a  print put out by GoodTimes video which contains not an ounce of restoration the film in grainy and difficult to see it doesnt even have a soundtrack I call that one the worst because Im still a little ambivalent about the  restored version by Georgio Moroder with color tinting good sound effects not so good and a soundtrack that includes songs by Loverboy Freddy Mercury Bonnie Tyler Adam Ant and Pat Benatar yuck!Those who study the film myself included find the story impenetrable Some films you can easily decipher but Metropolis has a plot that is so maddeningly erratic that its hard to pin it down as a whole Many conceded that as a fault but I think it adds to the films chaotic nature It takes place in the future restored versions offer title cards that suggest that its the year  but I dont go by that in an overcrowded city with immense skyscrapers the Gothic sometimes grotesque architecture suggests that the buildings were constructed in a hurry The rich in Metropolis are content with their lives dancing in their penthouses and spending their money The poor work as slaves beneath the city like cogs in a machine Lang choreographs the scenes in the subterranean levels magnificently so that the workers are never out of step They dont so much work as toil under oppression like Ramses slaves building his pyramids The rich and poor of Metropolis are ignorant of one another One person that isnt ignorant of the class division is Joh Fredersen a ruthless businessman who rules Metropolis from his officeHis son Freder happily enjoys the Pleasure Gardens one day when he notices a woman rising from the underground caves with a group of the workers children Curious he follows her to the depths and is aghast at the tyranny in motion there The woman is Maria a revolutionary who holds sermons to remind the workers that a peaceful resolution can and must be foundFreder uncovers a plot by Rotwang the mad scientist to create a robotic version of Maria to convince the workers to rise up and take arms This leads to the films most famous scene when the robot becomes flesh and blood and the false prophet opens her eyes to reveal two dead sparkling orbs Rotwang kidnaps the real Maria and sends the false one to convince the workers to rise up and then taunt the rich men and drive them into a sexual frenzyThen all Hell breaks loose but the rest I must leave to you to discoverLang based the film on the book written by his wife Thea Von Harbou In the book the story is about a chaotic as the film and therefore less successful the difference is that Lang has the visuals to suggest the chaos where the book did not He uses every technical tool at his disposal to visualize the Hell of the subterranean machine run by the workers At one point Freder disguised as a worker witnesses one of the huge machines explode and visualizes it as a horrendous monster swallowing workers by the dozen Another suggests an odd device a giant dial in which the worker is made to keep the arms in the same place as the light bulbs go on and off around its edge The machine doesnt seem to have any purpose until Freder imagines it as a giant clock and tries to pull the arms forward to end the merciless dayThe film is one of the pinnacles of German Expressionism astonishing in its use of light and shadow One of the best examples is the scene in which Rotwang pursues the real Maria through the caves using only a beam of light to strike terror as he closes in Another brilliant moment comes with Marias erotic dance as the men gawk the camera filled with their moist eyes This scene was completely removed after the initial release and not restored until home videoOther moments have deeper resonance There is something unsettling about the hundreds of workers toiling in the underground caves Walking to work they march with their heads down dressed in uniforms and caps It reminded me of the Jews being led into the Nazi Death Camps There is a buried foreshadowing of Hitler More obvious are Langs biblical references The rise of the city parallels Marias retelling of the story of the Tower of Babel The giant pentagram in Rotwangs lab as he plays God The breathtaking image of the plaguebringer who comes wielding an obscene scythe The very heaven and hell nature of Metropolis itself There is even a Christlike quality in Maria who gives her sermons and reinforces that indeed blessed are the peacemakersThese elements and images are brought to the film because of Langs insistence on no less then absolute perfection He was known as a sometimes cruel taskmaster working his cast and crew like a dictator He cast some  extras  of them for the Tower of Babel sequence alone and worked them from morning till night The water which covered the set for the climactic flood was ice cold Many of the extras were soaked through from morning till night Actress Brigette Helm was nearly killed several times once by a fall and another by the fact that the bonfire scene was real! Helm was so rattled by her experience working with Lang that she thereafter refused to make another film with himI could go on and on this film all great films invite lengthy discussions It can be seen in at least a hundred different ways as a foreshadowing of fascism or the tyranny of communism or just capitalism boiling over But when you get down to it the best way to view Metropolis is not as a film to pick apart but simply as a film of its time Lang created the story of a world gone mad while the world around him was going mad,0
18,This truly is a classic masterpiece and honestly one of the best movies ever made The story is brilliant and the visuals amazingI have seen the German  minutes version of the movie without subtitles Yes its a long watch but its worth every second of it Basically only reason why the movie is so long is because they need about ten hand gestures to speak one sentence Its kind of dreadful to look at first but once youre used to it it shouldnt trouble you anymoreIn many ways this movie can be regarded as the Blade Runner of the s Metropolis is set in a futuristic world that has a same kind of atmosphere as in Blade Runner The mix of s cars and propellerplanes with futuristic machines highways buildings and androids is very unusual but an absolutely awesome thing to look at The movie was ahead of its time and in some ways also propheticThe story is absolutely the best thing of the movie Also the way the story is told and directed by Fritz Lang deserves credit The story is tense and has quite some symbolism layers and storylines but remains always easy to follow The ending is truly spectacular and tense The way how spectacular and tense the ending and the entire movie in general was really surprised me in a positive wayThe sets are obviously fake and miniatures at times but they still manage to convince and impress Further more the movie is filled with some fantastic and very convincing early special effectsMan who also deserves credit is Alfred Abel Wow what a great actor he was in this movieAn absolute must see and one of the best movies of all time/http//bobafettblogspotcom/,10
