,commnets,Rating
11,For some nostalgic dreamers Gone With the Wind is a glorious swan song depicting the fall of the South during a devastating Civil War and its reconstruction on the ashes of the Old Order a Civilization forever gone with the wind Its the adaptation of Margaret Mitchells epic tale written in bold letters with this peculiar ability to portray the Yankees as the bad guys so common in the stories related by Southerners as they invite us to understand their idealism if not to root for it a vision of Gallantry and Old European Nobility where women were courted wives were submissive to their husbands and slaves treated with paternalismBut for some idealistic spirits Gone With the Wind resonates as one of the most heartbreaking pages of American History when the North fought the South in the name of Liberty Freedom and Justice and when History written by the victorious side ultimately showed the Confederate as the ones who were wrong Gone With the Wind chronicles what the South used to be a world where coexisted two cultures the Whites and the Colored And the depiction of the slaves oscillates between the high pitched voice of the simpleminded Prissy Butterfly McQueen who knew nothing about birthin babies and the wisdom and authority of Mammy Hattie McDaniel in her Oscarwinning role two figures two extremes so rooted in our hearts its impossible to dislike them despite the obvious stereotypesFor literate minds History is only the setting while the film is an incredible achievement in storytelling inviting us to follow a gallery of magnificent and appealing characters during a slice of life where the passing of time can be felt when History affects story with mercy or ruthlessness sometimes tragic sometimes ironic Its a narrative whose emotional core is the heroine Scarlett OHara Vivien Leigh whose heart belongs to the charming blonde Ashley Wilkes Leslie Howard married to the gentle and extremely goodhearted cousin Melanie Hamilton Olivia de Havilland A triangular love that sets the personality of Scarlett as a remarkable antiheroine selfish greedy jealous but so brave courageous and generous when the circumstances of War forever changed the face of the South A great soul that could only be revealed by a great opportunity a pivotal metamorphosis incarnated by the iconic As God is my witness Ill never be hungry againThe fascinating aspect of Scarletts personality is that her flaws elevated her above all the other characters she doesnt care for etiquette for traditions her spirit is free her ego is big and her heart so vulnerable While the South is definitely turned to the past Scarlett thinks of the future as she says after all tomorrow is another day Scarlett is a modern figure and thats what makes her so appealing both in the film and to the audience And Rhett Butler Clark Gable in his most defining role as the visitor from Charleston is Scarlets perfect match Both dont belong to that era they think of money greed prosperity and passion They embody all the values that America would stand for transcending the oldfashioned setting of the South But like the Souths enthusiasm for War the same pride that drives their passion would ruin their relationshipsFor many passionate hearts this is one of the most intense romances ever adapted to the big screen a frustrating and seemingly impossible love between two strongminded egos two faces staring at each other as if they were at the verge of an irresistible passion or about to fight each other As Scarlett was visibly jealous of Melanie when she went to bed with Ashley the movie makes you penetrate the soul of these characters with such intensity you could feel she wished that Melanie could die A childish and immature attitude probably shared with Butler who wouldnt have minded if Ashley could die in the War too The love between Rhett and Scarlett is made of the same idealism that built the South myth a lost but so endearing cause a fire that burnt inside and made pretty fitting that the most intimate and sensual moment they had was under the orange sky during Atlantas big fire Love has never been as passionate as a loveandhate relationship and never seemed a romance so comparable to a lost cause mirroring the Southerners very faith in victory Rhetts last stand when he takes Scarlett up the stairs in the one night she wouldnt turn him out is the perfect illustration of a love that pumped its energy from hate and anger As Scarlett lost in her love for Ashley will never realize that her man is Rhett and when she does Rhett is already fed up and finally delivers the most unforgettable comeuppance ever Frankly my dear I dont give a damn before disappearing in a foggy mist Scarlett gets a magnificent lesson about life and wouldnt have been as likable without this last slap in the face This I dont give a damn voted # in the American Film Institutes Top  Movie quotes was Rhetts revenge and he sure deserved it and many wannabeScarlett would admit that tooBut while Gone With the Wind deals with lost causes its more than anything the triumph of Cinema as the most defining Art of the last century Echoing the novels status as a best seller its one of the greatest films of all time the greatest casting ever the greatest score and the greatest challenge for superlatives Victor Flemings superproduction that would become a landmark in filmmaking with its unique visual style and beautiful cinematography in colors forever incarnated by Scarletts shadowy silhouette standing beside a tree during a beautiful sunset Along with The Wizard of Oz and Mr Smith Goes to Washington Gone With the Wind is probably Hollywoods Golden Age reaching its pinnacle before the War would come in  ,10
12,One of the greatest achievements in film history This is not only an eyepopping cinematic treat but one of the greatest stories ever put on celluloid The movie lasts nearly four hours its longer than any other mainstream commercially successful film ever made But the time goes by so quickly that youll miss it when its overOf course we all know that this movie is set in the days of the Civil War in the s Its the story of Scarlett OHara a plantation owners daughter who is very beautiful and who seemingly MUST have her own way at all times Shes willing to scheme and manipulate everyone in her path until she gets it When the movie opens the country is on the verge of civil war North against South but Scarlett barely notices and doesnt care in the least Her biggest obsession is that shes in love with dreamy/poetic Ashley Wilkes and she stays in love with him throughout  percent of the movie The only problem isAshley doesnt have any particular interest in her at all In fact he spends most of the movie being married to gentle Melanie Hamilton a fact that frustrates Scarlett to no end Ashley remains the one object of her desire that she is never to obtainShe would have been better off pining after Rhett Butler a much more solid rather dangerous man with a reputation as a nogood scoundrel He is openly attracted to Scarlett grows to love her although he dare not let her know or shell use it against him and its obvious that he would make a lot better match for her than the drab Ashley Very late in the movie he finally does marry Scarlett But its probably too late for them to be happy by then ironically and they never really are happy togetherThe complicated and utterly fascinating relationship between Scarlett Rhett Ashley and Melanie is the fuel that keeps the movie going But there are dozens if not hundreds of little extra twists and turns that fill out the movie The Civil War backdrop for one the colorful supporting roles for another A great many reviewers here have seen Scarlett as purely a selfish onedimensional manipulative shrew But shes far more than that! This is a complex multidimensional young woman with lots of conflicting motives Yes shes selfish and manipulative But shes also selfless the extreme sacrifices that she makes on behalf of her family and Melanie keeping in mind that other than her father she doesnt even particularly like any of them are nothing short of heroic She is overwhelmingly protective of her loved ones Shes a ball of fire when work needs to be done and shes fiercely courageous Despite her hardness she does also grow as a person To her great credit she slowly comes to value Melanies friendship and support She genuinely loves and is proud of her daughter And at the very end of the movie she does finally realize how illsuited she and Ashley have always been for each other and how little passion ever actually existed thereSome quick high points and a few flaws the supporting roles are superb in every way Even the rather bland Ashley is given as much life as could be expected by actor Leslie Howard and the other parts are vivid and fill out the movie Two female parts in particular wise funny respected Mammy Hattie McDaniel and wistful decentatheart prostitute Belle Watling Ona Munson are standoutsThe scenery and photography is possibly the most superb ever done in the history of film Many scenes are just sumptuously lit and filmed The gripping nighttime escape from Atlanta the whole city seemingly in flames is one of the most spectacular action sequences ever done The sunsets are jawdroppingly beautifulMuch has been said about the supposed racism of this film Its true that it does portray black slaves as being HAPPY to be slaves But much more important its also true that the wisest person in the whole movie is Mammy This black lady may be a slave later an employee but she is smart funny observant and shes treated as an equal if not a superior throughout the movie And its made clear she deserves it With no irony or rebuke whatever she scornfully refers to certain lowlifes as poor white trash and we know Mammy knows too that if they get called that they deserve it She may be black but she isnt inferior to them or anybody And we root for her all the wayA few minor flaws and I do mean minor  Most of the acting looks pretty modern but there are a very few scenes where it seems a little oldstyle Hey enjoy the movie and dont worry bout it People didnt do todays method acting in the s  Some of the raw scenes still have a Hollywood gloss to them Even when Scarlett is on the brink of starvation and probably hasnt had a good bath in weeks she looks perfectly made up with only a few hairs out of place Oh well It *was* bigtime Hollywood after all  The second half of the movie is more talky and less actionoriented than the first I would not say its more boring just less movement I dont find it draggy but some people do Still a heck of a good story and a great film so enjoy the ride!,0
13,Gone With the Wind is without a doubt one of the most magnificent romances ever A realistic fiction that ends abruptly and leaves its viewer/reader starving for more but unfortunately never produced a sequel A book was written in the s that continued the story but trust me it sucked Scarlett was such a complex character selfish spirited passionate about everything she wants But in the end you see that Scarlett changes she learns about communication and respect for all those who love her after she lost everyone who did Never read the sequel if you read the first one because it isnt a Margaret Mitchell novel and therefor you wont SEE the complexity Those of you who voted for this movie to have one star I pity you You cannot see the complexity or beauty of this wonderful tale or you just didnt see it and decided to vote for a movie you thought would be stupid when in fact it is the most popular civil war movie in history Please support this movie and give it FAIR votes It won ten Oscars and has claim to one of the most amazing casts ever so take that into consideration plus the effort it took when you give this movie a one/ten It deserves so much more,10
14,There has never been any movie in the cinema history that was more a legend than Gone with the wind It is undeniable that this movie contains lots of goofs but despite all this it is a blockbuster and a real masterpiece Completely NOT overratedI love this movie I cant explain why exactly There are sooo many reasons I first saw it when I was a little kid and still cant forget it Its so special if you can return to movie even when you had seen it more than  times And GWTW is this kind of a movieIn my opinion a movie can not be a good when the acting is not good And there acting is great! Every character is portrayed so magnificently!I will start with the supporting players Barbara ONeil though only  while filming played mother of quite adult daughters She was the Ellen Robillard Mitchell descirbed in her book so stative so smart so lady Thomas Mitchell should have received Oscar for his Gerald OHara portroyal and I think he did not just because he won for Stagecoach that year Scarletts sisters are really well cast But the best supporting performance of the film is this one of Hattie McDaniels She is simply magnificent moving and unforgettable as Mummy Just amazingMany people claim that Leslie Howard did not fit the role of Ashley They may be right in some sense but lets think it over twice Ashley was more handsome as Mitchell described him but he was a dreamer who could not find himself in a new cruel world And Howard showed this quality as best as possibleOf course Olivia de Havillands performance of Melanie was as worth of Oscar as Hattie McDaniels but later on she was given what she deserved Oscars for To each his own and The Heiress She plays Melanie with such a sensibility but she manages to show her hidden strength but not in a dominate way Clark Gable was so unsure of his talent till the end of his life I think that he was a great actor Hes so real as Rhett and he has to play several dramatic scenes And he does it perfectlyremember that playing those scenes like those after Scarletts miscarriage needed acting talent Hes perfect But I wont hide my opinion that Vivien Leighs Scarlett is the best and most powerful point of the whole movie Vivien won the role when she was completely unknown She managed to master the Southern accent as well She did not play Scarlett She WAS Scarlett But only in this movie She never acted any other character the same way She is terrific and has all those features that original Mitchells Scarlett possesses I heard that she wanted to play the part exactly as Mitchell created it and Fleming wanted her to play it just as a bitch so they fought about it badly but finally Vivien did a great work and her Oscar was something very obviousIf you love good cinema if you want to see something moving and something that is not getting old though almost ! do not miss it,10
15,Gone with the Wind is one of the greatest American classics ever made It tells the story of Scarlett OHara played the very beautiful Vivien Leigh She is one of the most selfish heroines you will ever see in a movie and still care for her She is in love with Ashley Wilkes Leslie Howard but he marries to Melanie Hamilton She is played by Olivia de Havilland in a great performance A new man in Scarletts life is Rhett Butler Clark Gable but Scarlett does everything to get what she wants including marrying someone for money and her own benefit Rhett loves Scarlett with all his heart mainly because they are much the same They both think the world is there for them Melanie and Scarlett become friendsThe movie is set in the time of the Civil War What happens exactly with Scarlett Rhett Ashley and Melanie is for you to see but the war is pretty important for the story and the way it is used is great The story itself is great anyway Although the movie is long it is never boring A reason for that is the performances I already mentioned Olivia de Havilland Clark Gable is very good charming and sometimes funny Hattie McDaniel as the black made is outstanding but I have to say that the best thing in this movie is Vivien Leigh To make you care for a character like that is a pretty hard thing to do but she makes it seem so easy It is one of the strongest performances I have seenBesides the story and the acting we have the music the sets the costumes the cinematography and of course the direction It is all great It was made in  and over  years later it still is a very impressive movie,10
16,I watched this movie for the first time at fourteen years old I enjoyed it immensely I have always been a fanatic for anything Civil War themed so when my mother recommended it to me it was a yes from the start The opening scenes show the young Scarlett OHara as she awaits her fathers arrival Beloved in the eyes of all the men in the county Scarlett has acquired a high selfesteem but when the War is announced to come after all the highspirited Scarlett soon faces obstacles that are determined to destroy her faith and her hope She meets many people along the way she even gets married With new relationships new responsibilities come as well Rhett Butler a man determined to have Scarlett for his own comes into her life half way through both the novel and the movie and he fights her on topics such as love politics and societal roles Even after the Civil War Scarlett is still faced with many decisions She has faced death marriage and defeat many times Still willing to go on even when it seemed impossible Scarlett leaves us with the last quote of the novel and book After all tomorrow is another day,10
17,If you have ever considered GWTW to be less than a masterpiece youll be swayed by the th Anniversary Edition DVD The disc set features the remastered film and more extras than you could possibly watch in one day after watching the film of course The twohour makingof documentary is fascinating and shows how the producer David O Selznick of the film affected the cast directors and writers  and shows the publicity frenzy that was the hunt for Scarlett The feature of Olivia De Havilland in  discussing her role as Melanie is a real treat The picture and sound are great on the th Anniversary DVD and the special features are a true treasure Accept no substitutes seek out the th Anniversary DVD and bring it home,10
18,Here is how I feel about Gone With the Wind My moms side of the family is Southern They lived mostly around where Scarlett and her gang hung out Some had plantations and owned slaves My grandparents were old fashioned in the clueless way Margaret Mitchell was Ive heard their side lots of times and I found it to be wrong If I were Black I wouldnt like to pass by statues erected to past oppressors either nor would I want to have flags in my face constantly reminding me of a sorrowful pastHowever please consider this If youre going to get upset at GWTW and ban showing it then you would also want to eliminate the rest of the movies from back then which show stereotypes as well correct? Unfortunately ALMOST ALL probably about  of Black roles for the stage and screen pres were just as racist as in GWTW many were worseThe problem is if you get rid of these movies you erase the work of any Black actors back then as well You wont see why Hattie McDaniel won an Oscar for a performance in a land so bigoted she could not sit in the audience during the premiere You wont see lots of superb singing dancing and acting by any AfricanAmerican during this time They will be completely ignored because of the contextYou wind up punishing all these people who wanted to work in entertainment and had little influence over the roles they played as well as those whites who made those moviesAnd Hollywood whitewashes and pretties up EVERYTHING It always has Dont get upset because they did it for the millionth time in GWTWConsider the movie  about ancient Sparta There was no mention of slaves they owned or the organized pedophilia that went into the training of boys Google it if you dont know what Im talking aboutAnd yet there were no mass protests at the rose colored vision in the movie No one came to picket the film because it omitted a horrendous flaw in Spartan societyWhy? Well for one thing that was well over  years ago What happened in Sparta is no longer directly relevant to anyone No normal modern army expects raping young boys as part of their trainingIts no longer relevantUnfortunately GWTW IS STILL RELEVANT Many of the problems portrayed in this film and any film from back then with Black actors are still haunting the US Denying that there is anything wrong and everything is just fine and has been fixed is simply denying realityWhy do I care? Unfortunately GWTW is one of my favorite books and films It has a strong still unique story of feminism I can relate to That is what is relevant to me in the film I have tended in the past to brush aside the slave part because it seems surreal to me to own people Im certainly not sitting there hoping the good ol days can come back I like the modern world with its aim of acceptance and tolerance I get the feeling the vast majority of viewers feel the same wayHow do we solve this problem? When Blacks are truly integrated and that day will come then GWTW will no longer be that relevant It wont strike any raw nerves The protests will die down just as they have for every other hot button issue whos time has come and goneTrue classics never die GWTW has many redeeming features which have made it endlessly entertaining to me and thousands of other people Keep talking about it show the movie now and then with perhaps a short lecture on history and context before and know that in time the pain will fadeALSO KEEP IN MIND when you criticize Scarlett for her actions there was NO OTHER WAY to survive in the Victorian world if you were a woman other than SEDUCING A MAN Its not like she could go off to college and get a degree Women were NOT allowed to own land have a bank accountvote hold a job besides perhaps a hat maker or much more commonly a prostitute etc If she seems strange for marrying men she didnt lovekeep in mind it was that or be totally broke and homelessMuch of the criticism of her character comes from total lack of knowledge about this contextAs for the movie itself I first saw it when I was thirteen It made quite an impression Forty years or so later it still moves me Some people criticize the main character Scarlett because shes not nice Shes not typical of a main female characterScarlett behaves in an uncomfortably realistic way Shes not a nice lady she is a superrare female antihero Shes not comfortingly evil but shes never going to be a goody two shoes Some people dont know how to handle thatMelanie on the other hand is criticized for being unrealistic I would ask anyone who thinks that to understand the context of the times she lived in There was no mass media save for the local newspaper and that was hardly an international trove of information as they are now No TV no radio no internet A person could grow up to be innocent in a way we simply dont experience in modern societyIts a movie about survival And its a war movie without battle scenes I would urge you to watch it,10
19,Im sorry I generally dont like this film Expansive epic picturesque an achievement for its time  OK A compelling story about the devastation hardship suffering and brutality of the Civil War and the courage and resilience of its survivors  OK but credit the novel for all thatA key problem is the heroine Scarlett OHara who remains insufferably selfish and inhumane throughout this long movie Are we supposed to admire her? I cannot Another problem is that the film drags in many places Too much screen time is focused on men professing love for Scarlett and Scarlett expressing her hopeless adoration for Ashley Gosh move on with it! Even for its time I cant see how its flaws failed to overcome its grandeur,6
